Let's see, my asking price was 50, your calling price 10, I raised you 2 clubs, you doubled, I redoubled, the stock market crashed, I doubted your double, you called me (just what, I'll never repeat), and we came to a gentlemen's agreement of 20 dinars. 	Let's see, my asking price was 50, your calling price 10, I raised you 2 clubs, you doubled, I redoubled, the stock market crashed, I doubted your double, you called me (just what, I'll never repeat), and we came to a gentlemen's agreement of 20 dinars. 
Let's see, my initial asking price was 50, you parried with 10, I gracefully riposted with 55, you countered with 20, I recountered with 60, you accounted, I encountered, we recounted and came up a couple short, so to make up the difference, we agreed upon whether the party of the first part is to pay the party of the second part part of the sums owing, but we tore up that contract and you are buying the Saurus for 50 dinars, COD.	Let's see, my initial asking price was 50, you parried with 10, I gracefully riposted with 55, you countered with 20, I recountered with 60, you accounted, I encountered, we recounted and came up a couple short, so to make up the difference, we agreed upon whether the party of the first part is to pay the party of the second part part of the sums owing, but we tore up that contract and you are buying the Saurus for 50 dinars, COD.
How much money do you have?  Maybe we can still work something out.	How much money do you have?  Maybe we can still work something out.
Why don't we shake hands, go back to our corners, and come out fighting at the sound of the bell.  Assuming, of course, that you DO want to deal.  Better yet, let ME deal.  That way I can take the cards off the bottom.  Shall we take it from the top?	Why don't we shake hands, go back to our corners, and come out fighting at the sound of the bell.  Assuming, of course, that you DO want to deal.  Better yet, let ME deal.  That way I can take the cards off the bottom.  Shall we take it from the top?
Do you think you can cheat Honest Ali Fakir?  You have to get up pretty early in the morning to do that, since I sleep in.  I need my beauty rest.	Do you think you can cheat Honest Ali Fakir?  You have to get up pretty early in the morning to do that, since I sleep in.  I need my beauty rest.
 Where was I?  Oh, yes.  You tried to pass me counterfeit coins.  I counter with a fit.  We agreed upon dinars, not whatever you tried to give me.  You need to see the Money Changer before we can deal again.	 Where was I?  Oh, yes.  You tried to pass me counterfeit coins.  I counter with a fit.  We agreed upon dinars, not whatever you tried to give me.  You need to see the Money Changer before we can deal again.
(Speaking of the Money Changer, I'd like to deal with her myself.)	(Speaking of the Money Changer, I'd like to deal with her myself.)
Why don't we shake hands, go back to our corners, and come out fighting at the sound of the bell?  Assuming of course, that you DO want to deal.  Better yet, let me deal.  That way I can take the cards off the bottom.  Shall we take it from the top?	Why don't we shake hands, go back to our corners, and come out fighting at the sound of the bell?  Assuming of course, that you DO want to deal.  Better yet, let me deal.  That way I can take the cards off the bottom.  Shall we take it from the top?
Just a minute and I'll introduce your saurus to you.	Just a minute and I'll introduce your saurus to you.
Ah, true love at first sight.  And what a sight for saurus eyes.	Ah, true love at first sight.  And what a sight for saurus eyes.
There's a lot of big game around here.  You know, pinochle, blackjack, soccer ...	There's a lot of big game around here.  You know, pinochle, blackjack, soccer ...
It's spring, and there is magic in the air!  Well, actually, it's summer, and there is something else in the air considering our proximity to the stable.	It's spring, and there is magic in the air!  Well, actually, it's summer, and there is something else in the air considering our proximity to the stable.
I've played in the palace before the queen.  Fortunately, the king wasn't around.	I've played in the palace before the queen.  Fortunately, the king wasn't around.
To travel the desert around here, you need a good saurus.  A good saurus will never desert you.  However, the saurus I have for you is your just desserts.	To travel the desert around here, you need a good saurus.  A good saurus will never desert you.  However, the saurus I have for you is your just desserts.
Speaking of money, you wouldn't happen to be interested in making an investment in the future?  You could contribute to the "Used Saurus Seller's Retirement Fund".	Speaking of money, you wouldn't happen to be interested in making an investment in the future?  You could contribute to the "Used Saurus Seller's Retirement Fund".
This is your chance.  All you need to do is contribute, and I'll throw in a used saurus.  Better yet, buy the saurus in the first place, and then I'll retire.	This is your chance.  All you need to do is contribute, and I'll throw in a used saurus.  Better yet, buy the saurus in the first place, and then I'll retire.
If you want to talk of thieves, take the money changer.  I'd like to take her myself.  She will certainly take you for everything you've got.	If you want to talk of thieves, take the money changer.  I'd like to take her myself.  She will certainly take you for everything you've got.
You call this hot?  I've been in places where every suit was a sweat suit.  I've seen it so hot that matches struck themselves.  I've been to Fresno!  Hot?  Ha!	You call this hot?  I've been in places where every suit was a sweat suit.  I've seen it so hot that matches struck themselves.  I've been to Fresno!  Hot?  Ha!
Ah, fair Dinarzad!  She'll change your money and steal your heart...or is it the other way around?	Ah, fair Dinarzad!  She'll change your money and steal your heart...or is it the other way around?
Personally, I'm a merchant.  I sell sauruses.  I'm the local saurus source.  Would you be interested in buying one?  I can make you a deal on a late model with all the options thrown in.  Options like saddle, bridle, two feet, ...	Personally, I'm a merchant.  I sell sauruses.  I'm the local saurus source.  Would you be interested in buying one?  I can make you a deal on a late model with all the options thrown in.  Options like saddle, bridle, two feet, ...
I've seen an awful lot of sauruses and I've seen a lot of awful sauruses.	I've seen an awful lot of sauruses and I've seen a lot of awful sauruses.
The saurus is the ship of the desert, and you can't ship it far enough to suit me.  All a saurus takes is a little grass (say, a bale), some water (around 20 gallons), and a little love, and it will follow you anywhere, which can get mighty embarrassing at times, believe me.	The saurus is the ship of the desert, and you can't ship it far enough to suit me.  All a saurus takes is a little grass (say, a bale), some water (around 20 gallons), and a little love, and it will follow you anywhere, which can get mighty embarrassing at times, believe me.
Picture yourself, mounting your very own saurus for the first time.  You get up, you fall off, you mount up again and sit proud in the saddle, knowing you can ride with the best of them.	Picture yourself, mounting your very own saurus for the first time.  You get up, you fall off, you mount up again and sit proud in the saddle, knowing you can ride with the best of them.
Ah, I wondered when we would get around to a reasonable question.  Do you have any idea how much a Saurus is worth?  What price glory?  Never mind that now.  I'll be happy to sell you a saurus for 100 dinars, but I'll settle for 50.	Ah, I wondered when we would get around to a reasonable question.  Do you have any idea how much a Saurus is worth?  What price glory?  Never mind that now.  I'll be happy to sell you a saurus for 100 dinars, but I'll settle for 50.
The Sultan (May He Reign Forever) is truly wise and powerful.	The Sultan (May He Reign Forever) is truly wise and powerful.
The palace is a marvelous place to work.	The palace is a marvelous place to work.
Traveling through the desert is much safer in a caravan.	Traveling through the desert is much safer in a caravan.
The coins of Shapeir are stamped with an image of the Sultan Harun Al-Rashid (May He Rule Forever).	The coins of Shapeir are stamped with an image of the Sultan Harun Al-Rashid (May He Rule Forever).
The Fountain is the heart of the city.	The Fountain is the heart of the city.
I have been by her house on Kudra Darb.  It has an eye painted upon the door.	I have been by her house on Kudra Darb.  It has an eye painted upon the door.
His poetry is very good.  I listen to him when he reads in the Plaza.	His poetry is very good.  I listen to him when he reads in the Plaza.
Only the Katta can stand to work the Bazaars in the summer.  The rest of the year, you cannot walk through the Plazas, there are so many merchants.	Only the Katta can stand to work the Bazaars in the summer.  The rest of the year, you cannot walk through the Plazas, there are so many merchants.
Foo.	Foo.
The one thing that will aid you most to stay alive in the desert is a good riding saurus.	The one thing that will aid you most to stay alive in the desert is a good riding saurus.
It costs but 50 centimes to stable a saurus there.  It shall be watered and fed regularly.	It costs but 50 centimes to stable a saurus there.  It shall be watered and fed regularly.
It is against our laws to bring a saurus into the city, since it can be fierce in defense of an owner.	It is against our laws to bring a saurus into the city, since it can be fierce in defense of an owner.
The Dervish lives in the Oasis to the South.  He knows everything that goes on in the desert.	The Dervish lives in the Oasis to the South.  He knows everything that goes on in the desert.
Bedouins are nomads whose home is the entire desert.	Bedouins are nomads whose home is the entire desert.
The Oasis is a place in the desert where there is life-giving water.  It is five skareen lengths to the South and three skareen lengths to the east from the town overlook.	The Oasis is a place in the desert where there is life-giving water.  It is five skareen lengths to the South and three skareen lengths to the east from the town overlook.
The bazaar is wherever the merchants are.  In the summer only the kattas can stand the heat.  Other times of year, you cannot move in the plazas for so many stands and shops.	The bazaar is wherever the merchants are.  In the summer only the kattas can stand the heat.  Other times of year, you cannot move in the plazas for so many stands and shops.
The thing of Earth was most fearsome.  The very city trembled from it.   We are most fortunate that Shema and Shameen brought you here.	The thing of Earth was most fearsome.  The very city trembled from it.   We are most fortunate that Shema and Shameen brought you here.
You can't see inside the waterskin.	You can't see inside the waterskin.
waterskin?  What waterskin?	waterskin?  What waterskin?
My name, he is Alichica	My name, he is Alichica
Ehhh...you wood knot want it.	Ehhh...you wood knot want it.
Sorry boss, all I got is a buncha burnt wood.	Sorry boss, all I got is a buncha burnt wood.
Wait a minute!  What you think I am, a money changer?   You money, itsa no good.  You need to getta this changed to dinars and centimes before you can buya something.	Wait a minute!  What you think I am, a money changer?   You money, itsa no good.  You need to getta this changed to dinars and centimes before you can buya something.
It's hot, it's red, it's something you cook with, it burned my stand down.	It's hot, it's red, it's something you cook with, it burned my stand down.
Special today only, I sell you a genuine Made-in-Japan, Glow-in-Dark Turban which says "My father went to Shapeir and all he brought me was..."	Special today only, I sell you a genuine Made-in-Japan, Glow-in-Dark Turban which says "My father went to Shapeir and all he brought me was..."
But maybe you gotta no kids?  Then what you want is what I gotta right here--a "Shapeir in a Bottle".  You shake it and you see Shapeir in a sandstorm.  I sell it justa for you for only twice what it worth.	But maybe you gotta no kids?  Then what you want is what I gotta right here--a "Shapeir in a Bottle".  You shake it and you see Shapeir in a sandstorm.  I sell it justa for you for only twice what it worth.
The stand seems to have been badly burned.	The stand seems to have been badly burned.
I am sorry, but I really cannot afford to give you any more free flowers.  Please visit the Money Changer.	I am sorry, but I really cannot afford to give you any more free flowers.  Please visit the Money Changer.
You will need to go to the Changer of Money to trade your coins for those of Shapeir.  But since you are a Hero to my people, you may have some of my flowers anyway.	You will need to go to the Changer of Money to trade your coins for those of Shapeir.  But since you are a Hero to my people, you may have some of my flowers anyway.
Since you are a friend of my people, then you may have some flowers even though you have not the money.	Since you are a friend of my people, then you may have some flowers even though you have not the money.
You put the flowers away.	You put the flowers away.
Please approach my flower stand if you wish to buy my flowers, Effendi.	Please approach my flower stand if you wish to buy my flowers, Effendi.
My name is Lisha, which means "Quiet One" in the language of the Katta.	My name is Lisha, which means "Quiet One" in the language of the Katta.
The strange man decided to leave town with his friend of the golden hair and strange social behavior.  He said something about going to "Fredonia."	The strange man decided to leave town with his friend of the golden hair and strange social behavior.  He said something about going to "Fredonia."
You're not close enough to the musician.	You're not close enough to the musician.
You don't dare, with such a vicious snake so near.	You don't dare, with such a vicious snake so near.
You see a Katta musician playing some sort of musical instrument and charming a dangerous-looking snake.  There are some brass coins thrown onto his carpet.	You see a Katta musician playing some sort of musical instrument and charming a dangerous-looking snake.  There are some brass coins thrown onto his carpet.
The Katta's Tail Inn sign has been burned beyond recognition	The Katta's Tail Inn sign has been burned beyond recognition
Fire sale today!   I sella you real wood burned by real Fire Elemental.  Be the first on your block to owna this.	Fire sale today!   I sella you real wood burned by real Fire Elemental.  Be the first on your block to owna this.
Here you go, boss.  One compass for %s.	Here you go, boss.  One compass for %s.
%d centimes	%d centimes
You pay for the compass and put it away.	You pay for the compass and put it away.
You no gonna regret this, boss.  Guaranteed the best in town or you no getta you money back.	You no gonna regret this, boss.  Guaranteed the best in town or you no getta you money back.
Sorry, boss--I justa ran outa them.  Maybe you come back tomorrow and I still notta have it.	Sorry, boss--I justa ran outa them.  Maybe you come back tomorrow and I still notta have it.
Here you go, boss.  One map for %s.	Here you go, boss.  One map for %s.
You pay for the map and put it away.	You pay for the map and put it away.
Gronk!!	Gronk!!
You're not close enough to the beggar.	You're not close enough to the beggar.
He doesn't need it.	He doesn't need it.
Alas, Effendi, money from the land of Spielburg is of no use to such as I.  You need to exchange it for the coin of our realm.	Alas, Effendi, money from the land of Spielburg is of no use to such as I.  You need to exchange it for the coin of our realm.
You have no food for even yourself.	You have no food for even yourself.
You have lured the Fire Elemental away from the Plaza.  Now you must try to weaken and capture it.	You have lured the Fire Elemental away from the Plaza.  Now you must try to weaken and capture it.
You're already laying it out as fast as you can!	You're already laying it out as fast as you can!
Unless you feel like scraping some off the alley floor, you'd better get used to the fact that you are incenseless.	Unless you feel like scraping some off the alley floor, you'd better get used to the fact that you are incenseless.
Ok, "You worthless, second-hand, unpolishable, thriftstore-hatched piece of unwanted brass!  Your kind makes me sick!  (and various grumblings)."  How's that?	Ok, "You worthless, second-hand, unpolishable, thriftstore-hatched piece of unwanted brass!  Your kind makes me sick!  (and various grumblings)."  How's that?
You have no water.	You have no water.
You should let the elemental get farther into the alley first.	You should let the elemental get farther into the alley first.
The Elemental is too far away to douse.	The Elemental is too far away to douse.
You put the lamp away.	You put the lamp away.
You don't see a lamp here.	You don't see a lamp here.
You can see the Fire Elemental burning brightly inside the brass lamp.	You can see the Fire Elemental burning brightly inside the brass lamp.
You don't see one here.	You don't see one here.
Actually, itsa like-a the alphabet.  You know, "H-I-J-K-Elemental-P.	Actually, itsa like-a the alphabet.  You know, "H-I-J-K-Elemental-P.
You wanna know where the Palace is, justa look on the map.  You finda the palace right by the Plaza of the Palace.	You wanna know where the Palace is, justa look on the map.  You finda the palace right by the Plaza of the Palace.
I tella you where to find the Guild Hall.  You go outa the Plaza here and take-a the street until you can turna left.  You go left until you can no go more.  Then you go right.	I tella you where to find the Guild Hall.  You go outa the Plaza here and take-a the street until you can turna left.  You go left until you can no go more.  Then you go right.
You want to find the Money Changer's, right?  No problem, boss.	You want to find the Money Changer's, right?  No problem, boss.
You go until you can see a way to go right and you go to the right.  Then you go until you can go to the right again.  Thatsa right way.  Go thatta way until you can turn right.  Go right until you come to a place where you can go right again.  Turn left.  Follow the road and you no can miss it.	You go until you can see a way to go right and you go to the right.  Then you go until you can go to the right again.  Thatsa right way.  Go thatta way until you can turn right.  Go right until you come to a place where you can go right again.  Turn left.  Follow the road and you no can miss it.
You think maybe you go visit the Enchantress, huh?  Well, go north from the Plaza of the Fountain.  When you come to a place where you can go south, go thatta way.  Keep going until you go north for two times.  The next time you go north, her house is the first door on the west.	You think maybe you go visit the Enchantress, huh?  Well, go north from the Plaza of the Fountain.  When you come to a place where you can go south, go thatta way.  Keep going until you go north for two times.  The next time you go north, her house is the first door on the west.
Special today only -- "Guide to Sightseeing in Beautiful Raseir".  Only costa you one dinar since it only gotta one page.	Special today only -- "Guide to Sightseeing in Beautiful Raseir".  Only costa you one dinar since it only gotta one page.
Genuine saurus foot trashcan for Mother's Day!  Show your mother what you thinka her.	Genuine saurus foot trashcan for Mother's Day!  Show your mother what you thinka her.
You needa souvenirs, I gotta them.  How about a pair of Glow-in-the-Dark Socks of Shapeir?  This-a way, you no lose your feet at night.	You needa souvenirs, I gotta them.  How about a pair of Glow-in-the-Dark Socks of Shapeir?  This-a way, you no lose your feet at night.
How you think you going to finda yourself with no map?  I sella you one cheap, only one dinar.  Special edition today, says-a "You are here" witha big-a "X."	How you think you going to finda yourself with no map?  I sella you one cheap, only one dinar.  Special edition today, says-a "You are here" witha big-a "X."
With a compass, you always know whicha way you going.  How many people you meet know that?  I give you a compass.  It only costs a dinar.	With a compass, you always know whicha way you going.  How many people you meet know that?  I give you a compass.  It only costs a dinar.
All right, you drive a hard bargain.  I give-a you this and you give-a me 50 centimes.	All right, you drive a hard bargain.  I give-a you this and you give-a me 50 centimes.
Okay, okay, we make a deal.  I sella you this for only 150 centimes.	Okay, okay, we make a deal.  I sella you this for only 150 centimes.
The Sultan (May He Live Forever) is a very great man and a father to us all.  He knows all that goes on in our land.	The Sultan (May He Live Forever) is a very great man and a father to us all.  He knows all that goes on in our land.
The Sultan (Around Whom The World Turns) was most displeased when the Emir Arus was deposed.  I have heard that there is a reward for restoring the Emir to his throne.	The Sultan (Around Whom The World Turns) was most displeased when the Emir Arus was deposed.  I have heard that there is a reward for restoring the Emir to his throne.
The Palace is the home of our Sultan, Harun al-Rashid, (May His Sons Be Many).	The Palace is the home of our Sultan, Harun al-Rashid, (May His Sons Be Many).
Ah, truly you belong there, for it is a place of heros!  It is to the west of the Plaza of the Fountain.	Ah, truly you belong there, for it is a place of heros!  It is to the west of the Plaza of the Fountain.
Those of the Inn are generous beyond belief, for they share what food they have left from the day with me.	Those of the Inn are generous beyond belief, for they share what food they have left from the day with me.
It has been said that the Sultan (Praise his name!) is even now searching for a Paladin, Effendi.	It has been said that the Sultan (Praise his name!) is even now searching for a Paladin, Effendi.
The Money Changer is at the end of the street Dinar Tarik, Effendi.	The Money Changer is at the end of the street Dinar Tarik, Effendi.
The poet shares his wisdom and art with all, and may heaven reward him for his kindness.  Sometimes words are worth more than food.	The poet shares his wisdom and art with all, and may heaven reward him for his kindness.  Sometimes words are worth more than food.
My name, Effendi, is Shihhad, which means beggar.	My name, Effendi, is Shihhad, which means beggar.
The Paladin is a mighty hero who only appears where he is needed, so the wise men say.	The Paladin is a mighty hero who only appears where he is needed, so the wise men say.
I live on the generosity of all men, and remind them what it is to be poor.	I live on the generosity of all men, and remind them what it is to be poor.
The elemental dodges easily in the open plaza.	The elemental dodges easily in the open plaza.
There is a Fire Elemental loose in the plaza!	There is a Fire Elemental loose in the plaza!
Hey, now there's an idea!  Maybe you should see about getting some.	Hey, now there's an idea!  Maybe you should see about getting some.
You don't have any water.	You don't have any water.
Your waterskin won't squirt that far.	Your waterskin won't squirt that far.
You can't seem to fetch the flames.	You can't seem to fetch the flames.
You pick out a basket large enough to contain a good deal of earth.	You pick out a basket large enough to contain a good deal of earth.
For that you must talk to Lasham, across the Plaza.	For that you must talk to Lasham, across the Plaza.
The Magic Shop is right here in this Plaza.  As a matter of fact, it is looking at you right now.	The Magic Shop is right here in this Plaza.  As a matter of fact, it is looking at you right now.
As you look the baskets over, you realize that you have little need for a basket right now.	As you look the baskets over, you realize that you have little need for a basket right now.
May fortune reward you.	May fortune reward you.
You don't have it to give.	You don't have it to give.
For that you must talk to Saba, across the Plaza.	For that you must talk to Saba, across the Plaza.
For that you must talk to Tashtari, across the Plaza.	For that you must talk to Tashtari, across the Plaza.
The Plaza of the Fountain bustles with the activities of the local merchants.	The Plaza of the Fountain bustles with the activities of the local merchants.
I am called Tashtari, which means "Sunset Glow."	I am called Tashtari, which means "Sunset Glow."
This lamp of brass should serve you against the thing of Fire.  It is now your own.	This lamp of brass should serve you against the thing of Fire.  It is now your own.
You're not hungry right now.	You're not hungry right now.
You put the rations away in your pack.	You put the rations away in your pack.
You try it and find that you like it.  It is soon eaten.	You try it and find that you like it.  It is soon eaten.
