Do you need one to capture the Fire Elemental?  I can let you have this one.	Do you need one to capture the Fire Elemental?  I can let you have this one.
This is the Apothecary, where one can buy many wondrous pills.  I am Harik.  If you need something, just let my know.	This is the Apothecary, where one can buy many wondrous pills.  I am Harik.  If you need something, just let my know.
You can use my marvelous pills to heal your wounds.	You can use my marvelous pills to heal your wounds.
Mana is magical energy.  My Mana Pills help restore it.	Mana is magical energy.  My Mana Pills help restore it.
The things you see here are mine and not for sale.  Only my pills are for sale.	The things you see here are mine and not for sale.  Only my pills are for sale.
You close the trap door.	You close the trap door.
You open the trap door to reveal a hole in the floor.  You can see Issur's strongbox inside the hole.	You open the trap door to reveal a hole in the floor.  You can see Issur's strongbox inside the hole.
Hey!  You don't have the money for this.  What do you think this is, a charity?  Get some money or get lost!	Hey!  You don't have the money for this.  What do you think this is, a charity?  Get some money or get lost!
Wait a minute!  What do you think I am, a money changer?  Your money is no good.  You need to get this changed to dinars and centimes before you can buy anything.	Wait a minute!  What do you think I am, a money changer?  Your money is no good.  You need to get this changed to dinars and centimes before you can buy anything.
Ha!  Easiest 10 dinars I ever made.  Let me know if you want to try again.	Ha!  Easiest 10 dinars I ever made.  Let me know if you want to try again.
Ha!  Easiest way I know of to get 20 dinars.  Let me know if you want to try again.	Ha!  Easiest way I know of to get 20 dinars.  Let me know if you want to try again.
Aw right.  Anyone can get lucky.  Here's your dough.	Aw right.  Anyone can get lucky.  Here's your dough.
Thanks, pal.  Easy money.	Thanks, pal.  Easy money.
There are swords, shields and many other weapons on the wall.  This shop seems well equipped to do business.	There are swords, shields and many other weapons on the wall.  This shop seems well equipped to do business.
There's no need to throw things around an empty shop.	There's no need to throw things around an empty shop.
Wasn't the purpose of breaking in to steal something?	Wasn't the purpose of breaking in to steal something?
A pointless thought, since you do not have a sword to trade nor do you have the skill to use one.	A pointless thought, since you do not have a sword to trade nor do you have the skill to use one.
A finer sword cannot be had than the one you've already purchased.	A finer sword cannot be had than the one you've already purchased.
Issur is not willing to change his price on his daggers.	Issur is not willing to change his price on his daggers.
You have the bellows.  What more do you want?	You have the bellows.  What more do you want?
You must need my bellows badly.	You must need my bellows badly.
Well, since you put it that way, I guess you do need the bellows.  I'll get it for you.	Well, since you put it that way, I guess you do need the bellows.  I'll get it for you.
OK, OK.  Since you are such a wimp, you only have to pay me 10 dinars if you lose at arm wrestling.	OK, OK.  Since you are such a wimp, you only have to pay me 10 dinars if you lose at arm wrestling.
Take it or leave it.	Take it or leave it.
You told me the story already, and besides, you have the bellows.  What else do you want?	You told me the story already, and besides, you have the bellows.  What else do you want?
You have told me that story already!	You have told me that story already!
Do tell.  Well, if you want to use my bellows, then you've got to prove your worth.  You'll have to defeat me at Arm Wrestling.  You win, you get the bellows.  You lose, I get 20 dinars.	Do tell.  Well, if you want to use my bellows, then you've got to prove your worth.  You'll have to defeat me at Arm Wrestling.  You win, you get the bellows.  You lose, I get 20 dinars.
That's a nice speech impediment you have there, but I don't know what you're saying.	That's a nice speech impediment you have there, but I don't know what you're saying.
Big deal.	Big deal.
There's no one to wrestle with.  Wasn't the purpose of breaking in to steal something?	There's no one to wrestle with.  Wasn't the purpose of breaking in to steal something?
Go away.  I've got better things to do than waste my time on you.	Go away.  I've got better things to do than waste my time on you.
It will cost you another 20 dinar to wrestle me for the bellows.	It will cost you another 20 dinar to wrestle me for the bellows.
It'll cost you more to bet me this time.  You'll have to put down %d Dinars.	It'll cost you more to bet me this time.  You'll have to put down %d Dinars.
You want to wrestle, eh?  Just to make it worth my while to put you in your place, why don't we make a little wager, say, 1 dinar?  Put down your money and we'll play.	You want to wrestle, eh?  Just to make it worth my while to put you in your place, why don't we make a little wager, say, 1 dinar?  Put down your money and we'll play.
Yeah, whaddya want?	Yeah, whaddya want?
The strongbox is much too heavy to move.	The strongbox is much too heavy to move.
You see no strongBox here.	You see no strongBox here.
Issur's weapons and armor are very distinctive.  You would not be able to use or sell them without being caught.	Issur's weapons and armor are very distinctive.  You would not be able to use or sell them without being caught.
Unfortunately, it appears that someone has already stolen all of its contents.  Now who would have done such a thing?	Unfortunately, it appears that someone has already stolen all of its contents.  Now who would have done such a thing?
You find 100 dinars and 500 centimes, which you happily put away.	You find 100 dinars and 500 centimes, which you happily put away.
You close and lock the strongbox.	You close and lock the strongbox.
You got it!  The chest is now open.	You got it!  The chest is now open.
You'll have to get the anvil out of the way first.	You'll have to get the anvil out of the way first.
There's something heavy preventing the trap door from opening...	There's something heavy preventing the trap door from opening...
Oh, it's you!  Stand somewhere else.	Oh, it's you!  Stand somewhere else.
The anvil is so heavy you can't even budge it.  Better work on those muscle-building exercises.	The anvil is so heavy you can't even budge it.  Better work on those muscle-building exercises.
You've returned the anvil to its original position to hide your illicit activity.	You've returned the anvil to its original position to hide your illicit activity.
You move the anvil aside.  Now you can get to the trapdoor.	You move the anvil aside.  Now you can get to the trapdoor.
All right, you can have the stupid bellows.  See if I care.	All right, you can have the stupid bellows.  See if I care.
He gets the bellows down for you and throws them at you.	He gets the bellows down for you and throws them at you.
Having traded in your old sword and paid 100 dinars, you now have one of Issur's swords.  For all his bragging, he does make a fine weapon.	Having traded in your old sword and paid 100 dinars, you now have one of Issur's swords.  For all his bragging, he does make a fine weapon.
With your skill in fast talking, you manage to bargain him down to 80 dinars.  Having traded in your old sword and paid the money, you now have one of Issur's swords.  For all his bragging, he does make a fine weapon.	With your skill in fast talking, you manage to bargain him down to 80 dinars.  Having traded in your old sword and paid the money, you now have one of Issur's swords.  For all his bragging, he does make a fine weapon.
He seemed thoroughly unimpressed by your bargaining skill.  Having traded in your old sword and paid 100 dinars, you now have one of Issur's swords.  For all his bragging, he does make a fine weapon.	He seemed thoroughly unimpressed by your bargaining skill.  Having traded in your old sword and paid 100 dinars, you now have one of Issur's swords.  For all his bragging, he does make a fine weapon.
Issur seems to make a well-balanced dagger, even if he does make you pay for the quality.	Issur seems to make a well-balanced dagger, even if he does make you pay for the quality.
You have shown yourself worthy by defeating me at arm wrestling.  Let me get them for you.	You have shown yourself worthy by defeating me at arm wrestling.  Let me get them for you.
He gets the bellows down for you and tosses them to you.	He gets the bellows down for you and tosses them to you.
You need to have the money before you go wagering!	You need to have the money before you go wagering!
I don't have any use for foreign coin, go see the money changer.	I don't have any use for foreign coin, go see the money changer.
Silly you, the door is already open.	Silly you, the door is already open.
Open the door if you want out.	Open the door if you want out.
Leave the door alone!	Leave the door alone!
It's open already.	It's open already.
It's closed already.	It's closed already.
Issur's strongbox is in this hole in the floor.	Issur's strongbox is in this hole in the floor.
Not much point in that!  The chest is already open.	Not much point in that!  The chest is already open.
You don't have the skill or the tools.	You don't have the skill or the tools.
The lock is too tricky for you.  You'll have to keep practicing.	The lock is too tricky for you.  You'll have to keep practicing.
Not in the middle of the day!	Not in the middle of the day!
The strongbox is already open.	The strongbox is already open.
You can't open the strongbox.  It's locked.	You can't open the strongbox.  It's locked.
The strongbox is already closed.	The strongbox is already closed.
The small wooden trap door is now accessible.	The small wooden trap door is now accessible.
You can just see the small wooden trap door underneath the anvil.	You can just see the small wooden trap door underneath the anvil.
The trap door is securely attached to the floor.	The trap door is securely attached to the floor.
The trap door is already open.	The trap door is already open.
The trap door is already closed.	The trap door is already closed.
You don't think Issur would appreciate that.	You don't think Issur would appreciate that.
That's funny -- your Open spell doesn't seem to work on an already open door.  Oh, yeah, that's right -- it isn't supposed to.  You resolve to be more diligent about your studies in the future.	That's funny -- your Open spell doesn't seem to work on an already open door.  Oh, yeah, that's right -- it isn't supposed to.  You resolve to be more diligent about your studies in the future.
The anvil is oiled.	The anvil is oiled.
An interesting idea, but you don't have any oil.	An interesting idea, but you don't have any oil.
Try going over to the anvil first.	Try going over to the anvil first.
You spread some oil around the base of the anvil.	You spread some oil around the base of the anvil.
You surreptitiously spread some oil around the base of the anvil, making sure Issur isn't watching.	You surreptitiously spread some oil around the base of the anvil, making sure Issur isn't watching.
You can't move the anvil -- the trap door is in your way.	You can't move the anvil -- the trap door is in your way.
The anvil is in its proper place.	The anvil is in its proper place.
Issur's heavy iron anvil doubles as a table for arm-wrestling.	Issur's heavy iron anvil doubles as a table for arm-wrestling.
You think it would take all your strength to even move the anvil.  Taking it is out of the question.	You think it would take all your strength to even move the anvil.  Taking it is out of the question.
The anvil, not being a door, is unaffected by your spell.	The anvil, not being a door, is unaffected by your spell.
You have the bellows.  What else do you want?	You have the bellows.  What else do you want?
You have the bellows.	You have the bellows.
The bellows are not in here.	The bellows are not in here.
Why would you need my bellows?  What's the story, bub?	Why would you need my bellows?  What's the story, bub?
You'll have to wrestle me for them.	You'll have to wrestle me for them.
You'd better not.  Issur would get upset.	You'd better not.  Issur would get upset.
Keep your distance!	Keep your distance!
You'd better ask Issur about the weapons.	You'd better ask Issur about the weapons.
The shop owner glares back at you.  He looks strong and decidedly unfriendly.	The shop owner glares back at you.  He looks strong and decidedly unfriendly.
He's too busy flexing to talk.	He's too busy flexing to talk.
That is very interesting.	That is very interesting.
You talk much, but say little.	You talk much, but say little.
Come over here and face me when you talk to me, wimp.	Come over here and face me when you talk to me, wimp.
The bellows is a sign of my trade.  What about it?	The bellows is a sign of my trade.  What about it?
Hey, what are friends for?  Let me get them down for you.	Hey, what are friends for?  Let me get them down for you.
He gets the bellows down for you and you put it away.  Good thing your spell lasted long enough.	He gets the bellows down for you and you put it away.  Good thing your spell lasted long enough.
If you want my bellows for something, you've got to earn it.  If you beat me at arm wrestling, you can have it.  If I win, you give me 20 dinars.	If you want my bellows for something, you've got to earn it.  If you beat me at arm wrestling, you can have it.  If I win, you give me 20 dinars.
No more questions.  Buy something or get out!	No more questions.  Buy something or get out!
Issur continues to smile at you.	Issur continues to smile at you.
Issur seems much more mellow now.	Issur seems much more mellow now.
The guards in Shapeir are nothing if not efficient.  You took too much time, and one of Shapeir's finest caught you in the act of this decidedly unheroic pursuit.	The guards in Shapeir are nothing if not efficient.  You took too much time, and one of Shapeir's finest caught you in the act of this decidedly unheroic pursuit.
The guards seem to have been waiting for you.  Someone must have robbed this store recently.	The guards seem to have been waiting for you.  Someone must have robbed this store recently.
That does it!!	That does it!!
You back again?  I'll let you stay if you want to buy something, but don't push it.	You back again?  I'll let you stay if you want to buy something, but don't push it.
What do you want now?	What do you want now?
Don't be coming over here!	Don't be coming over here!
The trophy seems to be firmly attached to the wall.	The trophy seems to be firmly attached to the wall.
The shield seems to be firmly attached to the wall.	The shield seems to be firmly attached to the wall.
The shrine seems to be firmly attached to the wall.	The shrine seems to be firmly attached to the wall.
The rack seems to be firmly attached to the wall.	The rack seems to be firmly attached to the wall.
The large mace seems to be firmly attached to the wall.	The large mace seems to be firmly attached to the wall.
The axe seems to be firmly attached to the wall.	The axe seems to be firmly attached to the wall.
The sword seems to be firmly attached to the wall.	The sword seems to be firmly attached to the wall.
The scimitar seems to be firmly attached to the wall.	The scimitar seems to be firmly attached to the wall.
The mace seems to be firmly attached to the wall.	The mace seems to be firmly attached to the wall.
The Tisk tusk is firmly attached to the wall with Tisk tusk tacks.  Tsk, tsk!	The Tisk tusk is firmly attached to the wall with Tisk tusk tacks.  Tsk, tsk!
The sheath seems to be firmly attached to the wall.	The sheath seems to be firmly attached to the wall.
The coat of mail is very heavy and too easily recognizable.  You decide to leave it alone.	The coat of mail is very heavy and too easily recognizable.  You decide to leave it alone.
It seems to be located in the plaza, not in the shop.	It seems to be located in the plaza, not in the shop.
Go ask someone else.	Go ask someone else.
You think I got nothing better to do than answer stupid questions?  Go away.	You think I got nothing better to do than answer stupid questions?  Go away.
This place has the best Weapon Shop in the world.	This place has the best Weapon Shop in the world.
