The thing is magic.  You need a magic user, not a fighter.	The thing is magic.  You need a magic user, not a fighter.
Now that's one tough sucker.	Now that's one tough sucker.
Magic is magic.  Go ask the weird guy at the Magic Shop.	Magic is magic.  Go ask the weird guy at the Magic Shop.
If you want monsters, go out in the desert at night.  That's where real men get weapon practice, not with some wimpy dame at the Guild Hall.	If you want monsters, go out in the desert at night.  That's where real men get weapon practice, not with some wimpy dame at the Guild Hall.
The Sultan has some good men working for him.  Some of the guards are my best friends.	The Sultan has some good men working for him.  Some of the guards are my best friends.
The desert is where you separate the men from the wimps.	The desert is where you separate the men from the wimps.
The stuff I sell is expensive, but you get what you pay for.	The stuff I sell is expensive, but you get what you pay for.
I don't like thieves.  The thief who breaks in here is in real trouble.	I don't like thieves.  The thief who breaks in here is in real trouble.
That place is for sissies.  After all, it's run by a woman.	That place is for sissies.  After all, it's run by a woman.
It's hot.  It's always hot.	It's hot.  It's always hot.
I don't much like nosy little twerps.	I don't much like nosy little twerps.
Nice dame.	Nice dame.
I am Issur of the House of Usher.	I am Issur of the House of Usher.
I am Issur, and this is my weapon shop.  I make the best swords and daggers.  What do you want?	I am Issur, and this is my weapon shop.  I make the best swords and daggers.  What do you want?
Hero of the Kattas, huh?  Only a Katta would call you a hero.	Hero of the Kattas, huh?  Only a Katta would call you a hero.
You again?  Come to taste defeat once more, no doubt.	You again?  Come to taste defeat once more, no doubt.
Ah, easy money,  So you want to make me rich?	Ah, easy money,  So you want to make me rich?
Well, wimp, it's about time you dare to pit your puny skill against mine at arm wrestling.	Well, wimp, it's about time you dare to pit your puny skill against mine at arm wrestling.
It's the fool and his money again.	It's the fool and his money again.
Ho, ho.  The beardless wonder has come to be put in his place again, I see.	Ho, ho.  The beardless wonder has come to be put in his place again, I see.
What a stubborn fool.  Just can't admit to yourself that I'm so much better than you at skills of strength.	What a stubborn fool.  Just can't admit to yourself that I'm so much better than you at skills of strength.
Well, Curly Locks, time for your daily defeat.	Well, Curly Locks, time for your daily defeat.
You know, we could save a lot of time if you just give me your money instead of losing it at Arm Wrestling.	You know, we could save a lot of time if you just give me your money instead of losing it at Arm Wrestling.
I make the finest weapons in all Shapeir!	I make the finest weapons in all Shapeir!
I can sell you the best daggers you've ever seen for only 5 dinars apiece.	I can sell you the best daggers you've ever seen for only 5 dinars apiece.
You need my sword.  A guy like you needs all the help you can get.  It will only cost you 100 dinars when you trade in your own sword.	You need my sword.  A guy like you needs all the help you can get.  It will only cost you 100 dinars when you trade in your own sword.
It takes real muscle to be good at Arm Wrestling.  I'm the best.  If you want to prove it, let me know and I'll be glad to wrestle you.	It takes real muscle to be good at Arm Wrestling.  I'm the best.  If you want to prove it, let me know and I'll be glad to wrestle you.
You got to work out daily if you want to build muscles like mine.	You got to work out daily if you want to build muscles like mine.
If you Arm Wrestle with me, you got to expect to lose.	If you Arm Wrestle with me, you got to expect to lose.
What's a wimp like you asking about EOF for?  Only real men join EOF.	What's a wimp like you asking about EOF for?  Only real men join EOF.
Paladins can fight good, but they're still wimpy goody-goodies and too high and mighty for EOF.	Paladins can fight good, but they're still wimpy goody-goodies and too high and mighty for EOF.
Those are my trophies from Arm Wrestling tournaments in Petalumeir.  They are not for sale.	Those are my trophies from Arm Wrestling tournaments in Petalumeir.  They are not for sale.
That is sold to someone else.  They'll pick it up tomorrow.	That is sold to someone else.  They'll pick it up tomorrow.
I work the metals there for my fine weapons.	I work the metals there for my fine weapons.
That is sold to one of the Sultan's guards.  He picks it up today.	That is sold to one of the Sultan's guards.  He picks it up today.
It is the finest suit of mail in all the realm.  Its value is far beyond you.	It is the finest suit of mail in all the realm.  Its value is far beyond you.
It's hot.  Don't touch it.	It's hot.  Don't touch it.
Those bellows are my sign.  What about them?	Those bellows are my sign.  What about them?
YOU	YOU
ISSUR	ISSUR
HOW TO PLAY  Enter key - holds back opponent SpaceBar - attempts slam LeftArrow - increases pressure applied RightArrow - decreases pressure applied 	HOW TO PLAY  Enter key - holds back opponent SpaceBar - attempts slam LeftArrow - increases pressure applied RightArrow - decreases pressure applied 
Ready!	Ready!
Set!	Set!
GO!	GO!
Your staying power diminished, Issur takes advantage of the opportunity to slam your hand to the anvil.	Your staying power diminished, Issur takes advantage of the opportunity to slam your hand to the anvil.
You can feel Issur weaken from the great effort he has taken to overcome your staying power.  You take advantage of the opportunity to slam his hand to the anvil.	You can feel Issur weaken from the great effort he has taken to overcome your staying power.  You take advantage of the opportunity to slam his hand to the anvil.
That be my place to stay.  I think you shall not go there.	That be my place to stay.  I think you shall not go there.
That will be the place to see just how good a fighter you are.  I get tired of not using spear and shield for so long a while.  Maybe you and I will go check out skills there.	That will be the place to see just how good a fighter you are.  I get tired of not using spear and shield for so long a while.  Maybe you and I will go check out skills there.
No magic, though.  I don't do magic.	No magic, though.  I don't do magic.
This Guild Hall is more colorful and primitive than others that you have seen.  As is the custom, artifacts are displayed on the walls, notices are posted on the Quest Board, and the emblem of the Eternal Order of Fighters is prominent.	This Guild Hall is more colorful and primitive than others that you have seen.  As is the custom, artifacts are displayed on the walls, notices are posted on the Quest Board, and the emblem of the Eternal Order of Fighters is prominent.
The open doorway leads to an area where we may practice.	The open doorway leads to an area where we may practice.
Uhura has already given you the note.	Uhura has already given you the note.
You have my sword, Hero.	You have my sword, Hero.
I will keep my sword, thank you.	I will keep my sword, thank you.
Step over to the book if you wish to read it.	Step over to the book if you wish to read it.
The last entry is "%s, Hero of Spielburg."	The last entry is "%s, Hero of Spielburg."
The log is for the most part written in a language you can't read.	The log is for the most part written in a language you can't read.
Step over to the book if you wish to sign it.	Step over to the book if you wish to sign it.
You have already signed it.	You have already signed it.
You sign your name in the book.	You sign your name in the book.
You would probably anger her if you tried, and you don't want to see her mad.	You would probably anger her if you tried, and you don't want to see her mad.
One does not just join the Eternal Order of Fighters, nor is this the place if you could.	One does not just join the Eternal Order of Fighters, nor is this the place if you could.
You will need the magic of a flaming sword to defeat the Earth Elemental.	You will need the magic of a flaming sword to defeat the Earth Elemental.
Permit me to loan you my sword, "Soulforge."	Permit me to loan you my sword, "Soulforge."
When you are in battle against the Elemental, the flame of the sword will aid you.	When you are in battle against the Elemental, the flame of the sword will aid you.
It will flame for the battle only, for it draws its strength from mine.	It will flame for the battle only, for it draws its strength from mine.
Please leave the sword with Uhura in the Guild Hall when you are done with it.	Please leave the sword with Uhura in the Guild Hall when you are done with it.
Good sword, good fight.  There are many be proud of you.	Good sword, good fight.  There are many be proud of you.
That was better.	That was better.
Goo goo ga ga goo.	Goo goo ga ga goo.
"Poltergeists make up the principle types of spontaneous material manifestations."	"Poltergeists make up the principle types of spontaneous material manifestations."
Goo goo, Maa Fhimt.	Goo goo, Maa Fhimt.
Watch it buddy!  I'm not getting hazardous duty pay on this gig, so don't mess with me.  They don't pay me enough to put up with a lowlife like you. Cheeeeeezzzz!!	Watch it buddy!  I'm not getting hazardous duty pay on this gig, so don't mess with me.  They don't pay me enough to put up with a lowlife like you. Cheeeeeezzzz!!
The warrior woman cradles baby Simba in her arms.	The warrior woman cradles baby Simba in her arms.
The warrior woman stands tall and proud.	The warrior woman stands tall and proud.
Maybe you find work for Hero here, too.	Maybe you find work for Hero here, too.
These make good salad for dinner.  That be very kind of you.	These make good salad for dinner.  That be very kind of you.
I try to be of help.	I try to be of help.
Maybe today you and I get in some more practice at fighting.   It will be good to feel the spear in my hand again.	Maybe today you and I get in some more practice at fighting.   It will be good to feel the spear in my hand again.
I am honored to aid you.	I am honored to aid you.
It is good to see you, young Hero.  A nice day to be adventuring.	It is good to see you, young Hero.  A nice day to be adventuring.
You've already returned the reward.	You've already returned the reward.
My thanks, but I have no need for gifts.	My thanks, but I have no need for gifts.
You show great honor.  May your deeds continue to shine!	You show great honor.  May your deeds continue to shine!
Imagine!  Such a warrior's tail used as a playtoy for a baby!	Imagine!  Such a warrior's tail used as a playtoy for a baby!
Rakeesh relaxes but his tail stays ever alert.	Rakeesh relaxes but his tail stays ever alert.
The baby fearlessly plays with the Liontaur's tail.	The baby fearlessly plays with the Liontaur's tail.
The kid's hangin' loose.	The kid's hangin' loose.
Don't bother.  He only tries to show off.	Don't bother.  He only tries to show off.
Rakeesh wouldn't appreciate it.	Rakeesh wouldn't appreciate it.
Hero types don't do that sort of thing more than once.	Hero types don't do that sort of thing more than once.
Hero types don't do that sort of thing.	Hero types don't do that sort of thing.
Uhura would have your head off before you got 10 feet. Besides, there is no baby market in Shapeir.	Uhura would have your head off before you got 10 feet. Besides, there is no baby market in Shapeir.
Maybe you do not hear so good.  I be thinking you give me back Rakeesh's sword, or maybe I be getting plenty mad.	Maybe you do not hear so good.  I be thinking you give me back Rakeesh's sword, or maybe I be getting plenty mad.
The standard Guild Hall Quest Board has an assortment of notices posted, but you must move closer in order to read them.	The standard Guild Hall Quest Board has an assortment of notices posted, but you must move closer in order to read them.
If you got real guts and don't know the meaning of fear; If you got real muscles and don't take guff from no one; If you got a real weapon and know how to use it; then maybe you are good enough to join the Eternal Order of Fighters.	If you got real guts and don't know the meaning of fear; If you got real muscles and don't take guff from no one; If you got a real weapon and know how to use it; then maybe you are good enough to join the Eternal Order of Fighters.
We pick only the best to join and we'll be watching you, so don't just be good, be great!  Be a member of EOF!  Eternal Order of Fighters The Guts, The Glory, The Greatest!	We pick only the best to join and we'll be watching you, so don't just be good, be great!  Be a member of EOF!  Eternal Order of Fighters The Guts, The Glory, The Greatest!
There is some writing on the EOF plaque on the wall, but you are not close enough to read it.	There is some writing on the EOF plaque on the wall, but you are not close enough to read it.
There will be given to the one who restores the Emir Arus Al-Din to his rightful place in the palace at Raseir the sum of 1000 dinars.  By order of the Sultan Harun Al-Rashid.	There will be given to the one who restores the Emir Arus Al-Din to his rightful place in the palace at Raseir the sum of 1000 dinars.  By order of the Sultan Harun Al-Rashid.
He who is willing to brave the desert should seek Harik Attar in his shop at the sign of the mortar and pestle by the fountain.  That one shall find rewards for his courage.	He who is willing to brave the desert should seek Harik Attar in his shop at the sign of the mortar and pestle by the fountain.  That one shall find rewards for his courage.
There is needed for a Spell of Great Power the whirling part of a Dervish.  Inquire at the Magic Shop.  Keapon Laffin, Prop.	There is needed for a Spell of Great Power the whirling part of a Dervish.  Inquire at the Magic Shop.  Keapon Laffin, Prop.
Those who do service to the city and land of Shapeir shall know the rewards of goodness.  By order of the Sultan Harun Al-Rashid.	Those who do service to the city and land of Shapeir shall know the rewards of goodness.  By order of the Sultan Harun Al-Rashid.
The Way of the Paladin: To seek. To learn. To do. 	The Way of the Paladin: To seek. To learn. To do. 
Uhura would be angry if you threw that at her Quest Board.	Uhura would be angry if you threw that at her Quest Board.
You will find better opportunities for social climbing by reading the quests.	You will find better opportunities for social climbing by reading the quests.
There is no reason to cast a spell at the Quest Board.	There is no reason to cast a spell at the Quest Board.
I do not know what you mean.	I do not know what you mean.
Maybe we be not speaking the same voice.  I be not knowing.	Maybe we be not speaking the same voice.  I be not knowing.
Rakeesh be saying that bad things happen here soon.  Bad magic, he come down, somebody has got to stop him.  Maybe you.	Rakeesh be saying that bad things happen here soon.  Bad magic, he come down, somebody has got to stop him.  Maybe you.
I not be seeing who leave it.  It come while I feed Simba.	I not be seeing who leave it.  It come while I feed Simba.
That be where you sign in to be adventurer in Shapeir.	That be where you sign in to be adventurer in Shapeir.
That be the motto of the EOF.  Read it.	That be the motto of the EOF.  Read it.
I learned to use that weapon when I was only little bigger than Simba.	I learned to use that weapon when I was only little bigger than Simba.
Simba means lion in my language.  Rakeesh say he sounds like a lion cub when he cries.	Simba means lion in my language.  Rakeesh say he sounds like a lion cub when he cries.
My land and people are many months travel from here.	My land and people are many months travel from here.
If you be fighting scorpion, you must watch the tail.  If the tail gets you, then you will be plenty sick, maybe dead, unless you get healing.  Block the Tail with shield, dodge the claws.	If you be fighting scorpion, you must watch the tail.  If the tail gets you, then you will be plenty sick, maybe dead, unless you get healing.  Block the Tail with shield, dodge the claws.
They be strong fighters, and they will gladly kill you for what you carry, if you let them.	They be strong fighters, and they will gladly kill you for what you carry, if you let them.
Ghouls be bad Magic things out only at night.  They eat the dead, but they will not be picky if they get the chance to eat you.  If they claw you, you get cold.  Colder you get, slower you move.  Too slow and you will be dead.  Then they eat.  You need good defense against them or they will pick your bones.	Ghouls be bad Magic things out only at night.  They eat the dead, but they will not be picky if they get the chance to eat you.  If they claw you, you get cold.  Colder you get, slower you move.  Too slow and you will be dead.  Then they eat.  You need good defense against them or they will pick your bones.
They not be all that tough, but many Jackalmen be wearing down even good fighters.	They not be all that tough, but many Jackalmen be wearing down even good fighters.
Dinosaur thing with many claws and teeth.  It likes to eat people.  Look out when it rears back on tail.  It can tear you up, if you do not dodge.	Dinosaur thing with many claws and teeth.  It likes to eat people.  Look out when it rears back on tail.  It can tear you up, if you do not dodge.
Strong fighter with claws and beak, it be.  Tear you to shreds unless you block and fight better.	Strong fighter with claws and beak, it be.  Tear you to shreds unless you block and fight better.
Simba's father be in the Sultan's guards.  Strong fighter, he be almost better than me.	Simba's father be in the Sultan's guards.  Strong fighter, he be almost better than me.
There be jobs, plenty rewards for good adventurers.  There be many more before I come here, but I be taking care of Simba too much now for jobs.	There be jobs, plenty rewards for good adventurers.  There be many more before I come here, but I be taking care of Simba too much now for jobs.
Rakeesh be very fine warrior.  He knows to be gentle and kind, too.  Very wise, very strong, but his leg be plenty bad, hurt him all the time.	Rakeesh be very fine warrior.  He knows to be gentle and kind, too.  Very wise, very strong, but his leg be plenty bad, hurt him all the time.
One very special, a Paladin be.  Talk to Rakeesh, he be knowing very much about Paladins.	One very special, a Paladin be.  Talk to Rakeesh, he be knowing very much about Paladins.
Rakeesh leg be broken badly in fight long time.  It did not heal right.	Rakeesh leg be broken badly in fight long time.  It did not heal right.
Men join to show off muscles and talk big.	Men join to show off muscles and talk big.
Someone must be sending the bad magic that comes here.  That wizard most likely be in Raseir, since the bad things happen there first.	Someone must be sending the bad magic that comes here.  That wizard most likely be in Raseir, since the bad things happen there first.
That thing be one of the people of the Djinn.	That thing be one of the people of the Djinn.
In the plaza of the Fountain be the man who makes things to help people.  He always needs things to be making what he does.	In the plaza of the Fountain be the man who makes things to help people.  He always needs things to be making what he does.
